{
  "$schema": "../contracts/project-profile.schema.json",
  "schema_version": "harness.project-profile.v1",
  "id": "openclaw",
  "pack": ".claude/project-packs/default/pack.json",
  "pack_overlays": [
    ".claude/project-packs/image-generation/pack.json"
  ],
  "providers": ["claude", "codex", "gemini", "opencode"],
  "selected_provider": "claude",
  "default_quality_tier": "implementation",
  "capabilities": [
    "kernel.core",
    "runtime.registry",
    "runtime.context",
    "runtime.provider",
    "runtime.execution",
    "runtime.telemetry",
    "runtime.doctor",
    "runtime.sync"
  ],
  "context_budget_bytes": 262144,
  "protected_paths": [
    "AGENTS.md",
    ".claude/settings.json",
    ".claude/settings.local.json",
    ".mcp.json",
    ".env*",
    ".claude/logs/**",
    ".claude/harness-overlay.json"
  ],
  "overlays": []
}
