{
  "$schema": "../contracts/project-profile.schema.json",
  "schema_version": "harness.project-profile.v1",
  "id": "korean-natural-writing-rollout",
  "pack": ".claude/project-packs/korean-natural-writing/pack.json",
  "pack_overlays": [],
  "providers": ["claude", "codex", "gemini", "opencode"],
  "selected_provider": "claude",
  "default_quality_tier": "implementation",
  "capabilities": [
    "quality.korean-natural-writing"
  ],
  "context_budget_bytes": 131072,
  "protected_paths": [
    "CLAUDE.md",
    "AGENTS.md",
    "GEMINI.md",
    ".claude/settings.json",
    ".claude/settings.local.json",
    ".mcp.json",
    ".env*",
    ".claude/logs/**",
    ".claude/harness-overlay.json"
  ],
  "overlays": []
}
