{
  "$schema": "../contracts/project-profile.schema.json",
  "schema_version": "harness.project-profile.v1",
  "id": "default",
  "pack": ".claude/project-packs/default/pack.json",
  "pack_overlays": [
    ".claude/project-packs/image-generation/pack.json",
    ".claude/project-packs/img2threejs/pack.json"
  ],
  "providers": ["claude", "codex", "gemini", "opencode"],
  "selected_provider": "claude",
  "default_quality_tier": "implementation",
  "capabilities": [],
  "context_budget_bytes": 65536,
  "protected_paths": [
    ".claude/settings.json",
    ".claude/settings.local.json",
    ".mcp.json",
    ".env*",
    ".claude/logs/**",
    ".claude/harness-overlay.json"
  ],
  "overlays": []
}
